“Two individuals with symptoms were retested and also found to be negative, and have since recovered,” said Cameron Kaiser. No one from the 1st group of Americans evacuated from #Wuhan has tested positive for the #Coronavirus, said #Health officials.
Latest on #coronavirus - The total number of cases in #China has risen to 42321, whereas the suspected cases is now at 23589. Death toll has cracked 1000, coming to 1012 and 3745 people have reported recovered from the virus infection.
More than 30 public buses have been turned into mobile food markets in Jincheng that service over 50 local residential communities amid novel #coronavirus outbreak 
2/10 #coronavirus Wuhan quarantine center is the concentration camp that takes away both life and money. That’s why people would rather risk their lives felling off the high rise, but not going to the quarantine center. This is their final right to say NO to CCP❗️❗️❗️ 
Ebola watching #Yaravirus and #coronavirus kill us all: 
Coronavirus concerns showing up in unexpected places in the global supply chain. Here are prices for garlic in Indonesia jumping 70% in a week: https://www.bloomberg.com/news/articles/2020-02-10/garlic-prices-jump-in-indonesia-on-worries-about-chinese-exports by @yeer28 #coronavirus 
2 major #Japanese #Tech companies—@Sony and NTT @DoCoMo—are the latest to pull out of a major #European #Technology show due to fears over the #CoronavirusOutbreak. 
Disinfecting the whole city. A truck is driving around Wuhan and spraying the streets with disinfectant. The number of fatalities from the new #coronavirus epidemic jumped to 1,011 in China. | China Daily via @Reuters #nCoV
Killer coronavirus outbreak's 40,000 cases may only be the 'tip of the iceberg', World Health Organization chief warns #CoronavirusOutbreak 
Central China's #Hubei Province, the epidemic's epicenter, reported 103 new deaths and 2,097 new confirmed cases of novel #coronavirus pneumonia on Feb. 10. The province now stands at: - 31,728 confirmed - 974 dead - Death rate: 3.07% - 2,222 recovered - 25,087 under treatment 
Trump’s answer to the #coronavirus is to propose cutting funding to the World Health Organization by 50%. This administration takes your breath away with their bewildering incompetence. #TrumpBudget
Here comes the best acting politician for #Oscars2020 —— Xi Video showing China’s president Xi‘s personal cult propaganda in making. before this stunt，he has been hiding after the deadly outbreak for days. #Coronavirus #WuhanCoronavirus #WuhanVirus
The #Coronavirus sure helped stop the infectious disease of virulent protests threatening to China’s losing its most priced asset - Hong Kong - before and after #Coronavirus a la @TierOnePatriot (redone on horizontal format to show the difference).#BioMediaWarfare https://twitter.com/TierOnePatriot/status/1226927061442465793
Still killing more than 100 people per day and yet flights from China are still landing in Canada everyday. How stupid can our government be? #CoronavirusOutbreak 
The #Cameroonian student diagnosed with #coronavirus has made a full recovery after spending 13 days in hospital 
Journalist missing in #Wuhan as anger towards Chinese authorities grows. This guys reports painted a worrying picture of the #coronavirus crisis at the centre of the outbreak and now he is silent/silenced. State censorship is a serious business in China. 
Looks like the US CDC has been successful in containing the #coronavirus - no new cases in the past few days. Good job guys. 
Chinese workers are back to work after days extension of the holiday break due to the outbreak. People use their own ways to protect themselves. Can they breathe? #coronavirus #coronaviruschina
Man suddenly collapsing while calling his family. Are these the last 15 sentences he spoke? We have no ideas. It was said that what he wore was shroud. One of the many scenes in #China during #CoronavirusOutbreak. #Coronavirus #coronaviruschina
"Confirmed #coronavirus cases by country: 🇨🇳 42,268 &amp; 1,011 dead 🇯🇵 161 🇸🇬 45 🇭🇰 42 &amp; 1 dead 🇹🇭 32 🇰🇷 27 🇹🇼 18 🇲🇾 17 🇦🇺 15 🇩🇪 14 🇻🇳 14 🇺🇸 12 🇫🇷 11 🇲🇴 10 🇬🇧 8 🇦🇪 8 🇨🇦 7 🇵🇭 3 &amp; 1 dead 🇮🇳 3 🇮🇹 3 🇪🇸 2 🇷🇺 2 🇰🇭 1 🇫🇮 1 🇳🇵 1 🇱🇰 1 🇸🇪 1 🇧🇪 1 TOTAL Infected: 42,729 Deaths: 1,013 Map: "
#Chinese media recently reported 2 #Coronavirus cases that reveal the challenges in detecting infections among patients who may not exhibit symptoms for several weeks after initial exposure to the virus. 
The toll keeps rising. #2019nCoV #NCP #coronavirus 
#Coronavirus toll on shipping: $350 million a week Falling volumes and canceled sailings hit container shipping, bulk operators face falling industrial demand. -@WSJ
Children volunteers from a Japanese social education organization sing a song from the animated series Doraemon and shout “Stay strong our Chinese friends, Stay strong, Wuhan people!” to encourage people who are helping combat the novel #coronavirus. #StayStrong
Aspects of a totalitarian regime includes the use of concentration camps, repressive secret police, religious persecution or state atheism, fraudulent elections and state-sponsored mass murder and genocides. #coronavirus 
"""The measures that we’ve taken—which were very aggressive—were an attempt to slow the thing down. But it’s spreading rapidly in China despite their aggressive measures to try to control it. And that’s worrisome,"" @DrNancyM_CDC at #NPCjilive #coronavirus #2019nCoV"
Company in central China's Hunan Province uses 3D-printing tech to make protective goggles 24/7, ensuring medical supplies for China's novel #coronavirus control efforts 
Over 130 people on a cruise ship quarantined near Tokyo have now tested positive for the new #coronavirus. Many of the passengers still on board say conditions are quickly deteriorating. #japan #yokohama #china
The latest on the #Coronavirus by @StefanMolyneux The footage of apartment buildings being welded shut to keep infected tenants trapped inside is horrifying.
THIS CHINESE BILLIONAIRE IS A CRITIC OF CHINA. DO YOU BELIEVE HIM OR GOV'T? MilesGuo: 'in #Wuhan, 49 crematories have been burning corpses 24/7 for at least 17 days, each day, 1,200 bodies burnt.' THAT COMES TO OVER 50'000 DEAD. #coronavirus 01
An advance team of experts organized by @WHO arrived in #China to help efforts against the new #Coronavirus, said @DrTedros. Some of the proposed team members were American, US officials have said, including experts from @CDCgov.
New Zealander Government - take note! Coronavirus can live on doorknobs and bus handrails for NINE DAYS https://mol.im/a/7987733 #coronavirus #nzpol
Of the total 42,760 persons around the world (42,299 in China) who have been infected with 2019-nCoV and treated, 4097 have been discharged and 1,013 have died. That leaves 37,650 pts still hospitalized. #coronavirus 
"""The FDA issued an emergency authorization of a test for the new #coronavirus, signing off on its use by state health labs."" Another development in the fight to stop the outbreak but lots of work to be done including lateral flow/rapid tests &amp; serology. "
... another chinese person trying to resist a disposal crew. #coronavirus 
As the #Coronavirus continues to surge, it’s pretty incomprehensible that we would consider cutting 34% from America’s global health programs. A disease threat anywhere is a disease threat everywhere. 
Coronavirus's deadliest day yet: 97 people are killed in 24 hours in China #CoronavirusOutbreak 
WTF! First saw this video first thing comes to me is this in #NorthKorea? Can’t be, they speaks Uyghur, looks #Uyghur, but behaves like people during the #CulturalRevolution. It’s unethical to let this happen not only the time of #CoronaVirus, but also during the normal days. 
Latest #coronavirus stats from #Hubei province: 2,222 released from hospital, 2,097 new cases, 103 new deaths. Total cases 31,728. #2019n_CoV #China
Does this satellite image show the scale of China's coronavirus cremations? #CoronavirusOutbreak 
"Well tonight we learn this Tory Dictatorship have again shown their incompetence to tackle the spread of #Coronavirus in Britain despite holding Arrivals from China in quarantine for 2 weeks in The Wirral &amp; yet there's 2 new cases in Brighton &amp; a School closed in Southampton?! 🤯"
Doctor Lin Zhengbin, a well-known transplant expert at Tongji Hospital in #Wuhan, died on Feb 10 at the age of 62 from infection with #coronavirus, less than 1 month after he was diagnosed. 
'Highly pathogenic' avian influenza hits two Chinese provinces near Hubei #CoronavirusOutbreak 
“It is very likely for the virus in the feces to be transmitted through the air fan into the toilet,” said professor KY Yuen. #HongKong officials evacuated a high-rise residential building where 2 residents contracted #Coronavirus on separate floors. 
60-yr-old man in C China's Henan Province was confirmed as having an asymptomatic case of novel #coronavirus #pneumonia on Sun, as he has no symptoms, like fever or cough, for 17 days, according to local health authority
Amazingly, the antimalarial #chloroquine (which is commonly used in #lupus) is highly effective for the control of the 2019-nCoV (#coronavirus) infection in vitro. Another incredible property of #antimalarials. #openaccess at https://www.nature.com/articles/s41422-020-0282-0.pdf
Ah so found out Simpsons predicted Corona virus too. 🥶😪 this shii was planned. #coronavirus 
China claimed—for almost two months—that coronavirus had originated in a Wuhan seafood market. That is not the case. @TheLancet published a study demonstrating that of the original 40 cases, 14 of them had no contact with the seafood market, including Patient Zero. #coronavirus 
Amid #coronavirus outbreak, A steam buns bakery in Beijing finds a clever way for customers to safely shop their breakfast by reducing the risk of cross-infection. 
Map released showing travels of 60,000 of the 5 million #Wuhan residence crossing all corners of the globe after fleeing before the quarantine of the epicenter. This is just the beginning of the #coronavirus pandemic, folks. – at National Institutes of Health (NIH)
📢 INFOWARS LIVE! The War Room with Owen Shroyer @allidoisowen: Monday 2/10/20 LIVE STREAM HERE: https://banned.video/channel/5b9301172abf762e22bc22fd #Coronavirus #CoronavirusOutbreak 
The china ambassador was on a Sunday show this weekend and would not deny the #Coronavirus could have been started in a weapons lab. Peter Navarro tells @MariaBartiromo China will have to be held responsible on how it started. pic.twitter.com/JHcWSTp5c9
"Per @lapublichealth, Despite rampant social media xenophobia,#CoronaVirus is NOT currently spreading in @CountyofLA.Please don't give in to hysteria, avoid stereotypes harmful to our Asian community &amp; continue to enjoy businesses operated by our Chinese neighbors #SheriffV #LASD"
This shop owner gave away thousands of face masks as well as handmade sanitiser, as #coronavirus fears drive up prices of the supplies 🧐😷☠️ 
Inside #coronavirus quarantine zone: #Wuhan Union Hospital medical workers reveal the daily struggles
A GP surgery in Brighton has been closed after it was linked to one of the UK coronavirus cases. Get the latest on the #coronavirus here: https://trib.al/nGm6ewz
Over 200,000 sign petition demanding WHO director Tedros Adhanom Ghebreyesus resign amidst apparent mishandling of #coronavirus outbreak 
Sorry, I had to remove the video of a woman falling the building during #coronavirus quarantine in #China, as Twitter told me that video violates its rule. Have you read about the report that #WHO is working with google and social media giants to control “misinformation”?
Look at the effects of #coronavirus on Shanghai. An economic pillar of Chian in a standstill 
A team of intl health experts sent by World Health Organization (@WHO) has arrived in #Beijing on Mon to work with Chinese counterparts to increase understanding of novel #coronavirus and address practical questions, #WHO announced on twitter
The #Shanghai government just announced some terrible news The #Coronavirus IS airborne. It can be spread through the air EVEN if the infected person isn't present. Previously many doctors advice was to maintain a 1-2m distance and not wear a mask. This advice is now useless!
It now seems highly likely that the #CoronavirusOutbreak has happened as a direct result of the illegal wildlife trade It's long been predicted disruption of wild animal populations might result in new emergent diseases Those warnings have been ignored 
Last year, Carrie Lam banned face masks. Flash forward to today ... face masks have become the most valuable commodity in #HongKong (and elsewhere), as the threat and death toll from the #CoronaVirus outbreak climbs. 
RADIOLOGY: Full set of images on coronavirus -- now live!! see https://pubs.rsna.org/2019-ncov #coronavirus @radiology_rsna #radiology https://twitter.com/RadiologyEditor/status/1225904064963190784
Due to increased concern in our community about the spread of the #Coronavirus, @MDCPS has developed a guide with resources so that parents/guardians have the correct information on how to protect their children. #SafetyFirstMDCPS
world's most populated city!! Can you believe this?? Shanghai, deserted....streets stay empty Is rest of world is ready for such an emergency??? It is high time UN start working on to combat deadly Coronavirus outbreaks. #coronavirus #coronovavirus #Wuhan #china #corona
#coronavirus still not trending with Google. In fact, nothing even related to Coronavirus since the Li Wenliang story on Feb.6th. Of course, it was only trending at number 20 that day. 
There are concerns about the global spread of #coronavirus, with a new map showing the predicted movements of 60,000 Wuhan residents who fled the Chinese city before it was placed into lockdown. 
A hospital in Nanjing, E China's Jiangsu, has put a virus-killing robot to work to combat #coronavirus. The smart robot can turn 360 degrees in tight places to conduct disinfection, keeping medics safe from cross infection. 
With all the fear spreading about #coronavirus lately, I hope we won’t let this crisis divide us even further as a human family. I‘ve read some pretty racist comments and it makes me so upset. The West and East have to stand together now. We‘re all in this together. 🇨🇳 🌎 
"News you can use (srsly): @ScottGottliebMD on how to limit spread of #coronavirus. One tip: if using hand sanitizer, be sure to allow it to dry. ""It’s the evaporation of the alcohol that makes these products effective."" #2019nCoV"
What I’ve learned from this #coronavirus outbreak is that I should never, under any circumstance, go on a cruise. 
That's #DumbDonald's strategery for dealing with the #coronavirus? Wait for nicer weather? We are in serious trouble, folks. Leadership matters. Incompetence kills. #MoronInChief #IQ45 #ImpeachHimAgain
2 American passengers who are being held on a #Quarantined cruise ship off the coast of #Japan that has seen more than 100 cases of the new #Coronavirus have asked the @WhiteHouse for help.
#chinalockdown #tanzania #wanafunzi #coronavirus 😭😭😭 They aren’t infected yet,let’s please bring them back home. Bado hawajaathirika, naomba tuwarudishe Nyumbani. 
China's #HongKong has donated more than 1 billion yuan (143 million U.S. dollars) and also medical equipment for novel #coronavirus control efforts in the mainland, said Liaison Office of the Central People's Government in HK on Monday 
"#coronavirus ""When you're in self-isolation for 14 days, occasionally come out and take out the trash. "
coriiiiiiiiiiii (@coriiiiiiiiiii1) Tweeted: Chinese billionaire shares #coronavirus case numbers. Claims that millions are infected and tens of thousands have died. Draconian measures seem to be impelemented. 
Interesting 🤔 why isn’t the MSM relaying this to us? What’s exactly going on? Who is behind this evil biochemical warfare—back grounded plan that is in full fruition? #coronavirus 
We still don’t know important basics about #coronavirus, from who has been tested to what proportion of people develop mild, severe or critical symptoms. As I explained on @CNN, we need that critical information to know what to expect next from #nCoV.
#coronavirus body bags by the thousand 
One BBQ cookout party of 19 people ==> yield 9 infected in HK. That’s quite an infectious #coronavirus. Hong Kong and Singapore are becoming new hotspots of infection. And I trust HK/SG reports more than mainland China reports at this point because democracy = transparency. 
A doctor spoke up about #CoronavirusOutbreak. Days later he died. A journalist warned the world of its severity. He disappeared. #Xi and the Party have lost the public’s trust. Let’s hope the Party is over soon.
"All-knowing Dr. Trump tosses another bone to the cult. There is no where he doesn't see himself as the ultimate expert; that puts everyone in danger. #resist #VoteBlueToSaveAmerica #mepolitics #coronavirus "
"Bannon: No more playing games, no more guessing Burden of proof is on the #CCP. It’s not on the West to find information on #coronavirus; incumbent on CCP to have full disclosure, grant full access into China 👉http://warroom.org/podcast"
"Another video from inside the #Fangcang ""Hospital"" in #Wuhan, which were converted from sports &amp; exhibition centers to quarantine #coronavirus patients with minor symptoms #coronaviruschina #CoronavirusOutbreak #方舱医院 内部视频。#武汉肺炎 #新冠肺炎"
Because of #coronavirus, Indians are not going to 'Chinese' restaurants in India. It shows why Modi can fool them so easily.
20 minutes on the #coronavirus hashtag and I’ve now spent a couple hundred in emergency supplies on Amazon including an axe.
Why are people in China wanting to spread #CoronaVirus? What type of mentality is this? 
Hong Kong authorities evacuate Tsing Yi estate flats after second resident diagnosed with coronavirus https://www.hongkongfp.com/2020/02/11/hong-kong-authorities-evacuate-tsing-yi-estate-flats-second-resident-diagnosed-coronavirus @creery_j #HongKong #coronavirus
27 foreign nationals have been diagnosed with novel #coronavirus, among whom 3 have been cured and discharged from hospital, 2 have passed away, and 22 others are isolated in hospitals, Chinese Foreign Ministry said Mon. 
2/10 #coronavirus Face mask is in extreme scarcity in China.People can’t find it in physical or online stores. The shops that still offer masks are charging super price . Result? When people went outside without masks, they were beaten to death, even for the old and girl! 
When HK medical staff is facing shortage of equipment to prevent #coronavirus infection, proeltective garments are wasted on #HKPoliceTerrorists.
A friend is watching the midnight evacuation of Hong Mei House at Cheung Hong Estate in Tsing Yi with great anxiety. Residents were asked to move after two cases of #coronavirus were found in same building, despite living ten storeys apart.
#Gravitas | The dragon is struggling in its fight against the #Wuhan virus. With more than 40,000 cases and over 900 people dead - the situation is now getting worse. @palkisu tells you the 5 reasons why #China is failing in its fight against the #coronavirus 
It's nice to know that #China is strictly enforcing their current quarantine. Feeling much safer. #coronavirus - don't go outside. https://twitter.com/sotiridi/status/1224481802720509952/video/1
In many different places, they all came up with the same most secure method the make sure you don't escape the #Coronavirus quarantine: weld your gate or your door, one of the many scenes in #China during #CoronavirusOutbreak 防 #武汉肺炎 把门焊死 来得最直接 #新冠肺炎 #全民反抗
Virus can't put out the passion for life! Video shows #coronavirus infected patients with mild syndromes isolated in a temporary hospital in #Wuhan taking up dancing.
Large-scale #coronavirus disinfection operation in #Wuhan
THIS ISTHE BIGGEST AND MOST IMPORTANT STORY IN THE WORLD #coronavirus Veterans are you prepared?! Do you have 30 days or more of supplies?! Get it done. Report back to me when you do. I am working on it. Common Sense preparation. 
Hong Kong - Vertical transmission of #2019nCoV #coronavirus in leaky toilet vent pipe and distributed via exhaust fan? Apartment block evacuated. https://flutrackers.com/forum/forum/-2019-ncov-new-coronavirus/china-2019-ncov/822159-hong-kong-2019-ncov-confirmed-cases-and-news?p=828607#post828607 scroll down h/t @PenguinSix @XinqiSu , Shiloh
"#coronavirus Update: My Worldwide Case Count Just updated: New cases in #HongKong, #Singapore, #UK &amp; #China. No new deaths. Note: #China is likely downplaying the numbers #WuhanCoronavirus #CoronavirusOutbreak #2019nCoV #WuhanPneumonia"
Wuhan officials discover 1,499 critically ill coronavirus patients through door-to-door health checks #CoronavirusOutbreak 
"I’m aware of concern in #Brighton about new cases of #coronavirus All were in contact in France with a previously confirmed case I’m in close touch with @PHE_uk &amp; @BrightonHoveCC and will continue to share what information I can. More here https://www.carolinelucas.com/latest/coronavirus-update"
coronavirus Illustration of how does the #Coronavirus spreads? 
Chinese authorities must immediately account for the whereabouts of journalist Chen Qiushi, and ensure that the media can cover the #coronavirus outbreak in #Wuhan without fear of retribution.
Chinese Ambassador to Pakistan, Yao Jing released a video message to address the Pakistanis currently in China as the country battles the ongoing pandemic of coronavirus. #ARYNews #CoronaVirus
Having reached the end of my two week #coronavirus quarantine period it’s amazing to go out onto the streets of Beijing and see it heaving with millions of people not afraid of contamination. #China
Experts have Warned that the #Coronavirus has just started to show its early stages. The Incubation period is now of 24 days. Experts say If appropriate steps are not taken now, this Virus will even be more stronger and deadlier then it is now #Coronaoutbreak
This is rich coming from the @CBC , Liberals blaming the state of our economy on the #coronavirus , of course it has nothing to do with the complete failure of Team Trudeau .. What a crock .. #TrudeauMustGo #cndpoli #FakeNews
Finance Minister Morneau said on Monday the spreading #coronavirus outbreak will hit the Canadian economy in particular, oil prices Is he really gearing up to veto the Teck deal over the coronavirus? 
We stand with #China: My #SandArt with the message, Fight against #CORONAVIRUS at Puri beach, #Odisha India .
The @WHO's director praised the “transparency” of China's response to #coronavirus. China detained journos, cracked down on social media and gave misleading data in aftermath of outbreak. Kow-towing to #CCP seriously harms WHO's credibility.
Even Beijing looks more like a ghost town. #coronavirus 
As #Chinese cities become ghost towns amid #Coronavirus fears, the true nature of the epidemic might be far more dire than what the Chinese regime is letting on. How serious is it really? IN-DEPTH REPORT by @ZoomingIn_NTD | WATCH: http://youtu.be/3yZliBftSaM
In an era of #coronavirus in #China, money is no longer the best thing in the world. #coronovavirus #corona #ChinaVirus #WuhanVirus
"Young Chinese and Mainland students in New York City held a memorial for #coronavirus whistleblower, #LiWenliang, on Feb 9 at Central Park. Participants were chanting ""A healthy society should allows more than one voice."""
Trump gives an update on the #CoronavirusOutbreak while delivering remarks at business session with U.S. governors 
"Repost ↪️ ""When you're in self-isolation for 14 days, occasionally come out and take out the trash.—Mulan Hua"" #coronavirus #coronovavirus #ChinaVirus #WuhanVirus #Corona"
#coronavirus shows how open borders is a risk to the public health. 
#Britain’s health department declared the new #coronavirus an “imminent threat” to public health and announced a series of measures to combat the spread of the virus, a sign of the seriousness with which local health authorities are treating the fears of the epidemic.
A 60-year-old man in Central China's Henan province was confirmed as having an asymptomatic case of novel #coronavirus pneumonia, as he has no symptoms, like fever or cough, for 17 days.
#Coronavirus #NCP China: outbreak started in Dec. Research: outbreak started in Nov. China: limited human to human transmission early on Research: hcw smoking gun of human transmission, early h2h China: sharing sequencing Researchers: no current info
BREAKING: A medical centre in Northamptonshire has closed due to a potential #coronavirus incident. Get the latest on the virus outbreak here: https://trib.al/aUKxKpW
Students from various universities in Wuhan explained their problems to SAPM @sayedzbukhari during the conference call today, including the food availability and evacuation of high risk persons. #coronavirus 
Blocking the gate with characteristics of Northeast #China. With below zero temperatures, the gate will soon be blocked with solid ice as strong as rocks. Let's pray for summer. One of the many scenes in #China during #CoronavirusOutbreak. #coronavirus 
"These Christians understand eternity and that this life is but a blink; so they are coming boldly out from “underground” to share the saving gospel! Pray for them! May we all sense an URGENCY to tell others about Jesus TODAY! 🙏 #Wuhan #coronavirus "
