With the coverage on Moi’s passing on behind us, let's now focus on the misinformation, disinformation & ill information over the New Strain Coronavirus (COVID-19). Media to blame or inept Government? #PressPass with @BernardMwinzi @mosmasika @omollo_eunice and @CiruMuriuki
VIDEO: #China “It’s just a flu, Don’t worry everything is Fine!” Shocking video from China shows Disinfectants being sprayed inside offices in China. If you will not die due to #Coronavirus. You will definitely die due to Lung Cancer. #Coronaoutbreak 
We’ve been hearing some wild myths about COVID-19, so we thought we should address a couple of them. Myth #2: Are hand dryers effective in killing COVID-19? For more info visit http://York.ca/coronavirus or http://WHO.int/coronavirus for more myth busters.
"Jim Baker says that the ""silver solution"" he sells will kill the #CoronaVirus 🤦‍♀️🤦‍♀️🤦‍♀️ "
Epidemic Preparedness: Coronavirus (COVID-19) funding call | Wellcome 
BREAKING: The World Health Organization says that there is no significant change in the trajectory of the COVID-19 outbreak. 
Hubei is moving in the right direction for including clinical diagnosis methods in confirming patients, epidemiologist Zeng Guang said in an interview with Global Times Editor-in-Chief @HuXijin_GT on Thursday. #coronavirus #COVID-19 
🚨⚠️Due to the current #coronavirus outbreak, @FIBA Asia has taken the decision to postpone the following #FIBAAsiaCup 2021 Qualifier games: 20 Feb: PHI vs THA 21 Feb: JPN vs CHN 24 Feb: CHN vs MAS The new dates will be announced later!
Our Valentine poem for you: Roses are red Violets are blue Let's use COVID-19 virus And not SARS-CoV-2 
The number of people infected with the COVID-19 coronavirus on the quarantined Diamond Princess cruise ship has risen to 218 — making the ship the largest cluster of the virus outside China. 
#Wuhan and all of China looks like a nightmare because of the #Coronavirus. #COVID19
Folks, it's becoming very apparent that the Chinese government has a lot to hide. Not just censorship, now journalists that were covering the COVID-19 atrocity for the rest of the world are now coming up missing. #Coronavirus https://twitter.com/QuickTake/status/1227939410546692096?s=20 https://twitter.com/KTHopkins/status/1227888736324681735?s=20
CDC will begin using the national flu surveillance tracking system with health departments in 5 cities to test patients with flu-like symptoms for #coronavirus. This is an important and prudent step that’ll help identify outbreaks earlier. The cities are SF, LA, ATL, Chicago, NY.
Coronavirus: How well prepared are countries for a covid-19 pandemic? 
With venues shuttered in the wake of the COVID-19 “coronavirus” outbreak, China’s indie musicians are live-streaming shows. 
I don’t know who needs to see this, but if you think you have COVID-19, DONT DO THIS! 
*pinches bridge of nose* Not a medical professional, but just in case any of you were wondering: coronavirus is the term for a broader group of viruses. That’s why this virus is specifically named Novel Coronavirus 2019 or Covid-19. 
The Wellcome Trust and DfID have just launched a funding call to better prevent and control the novel coronavirus, COVID-19. https://wellcome.ac.uk/funding/schemes/epidemic-preparedness-covid-19 @wellcometrust @DFID_UK #coronavirus #covid19
The first death in Japan from COVID-19 yesterday. An elderly woman with no travel history or connection to China admitted to hospital outside Tokyo on Jan22 with fatigue. She was treated for 3weeks before her test was positive and she succumbed. We need to brace ourselves.
"China could be under reporting cornavirus (COVID-19) cases by at least 100,000 and ""severely"" under reporting the number of deaths, according to a tweet by Fox Business Correspondent Edward Lawrence, citing administration sources. "
Questions raised over protective gear as Japan quarantine officer gets COVID-19 
Here's why there was an explosion in the count of COVID-19 infections and deaths today. 
This is what people think about the threat of COVID-19 coronavirus http://bit.ly/38pGHIx #China #coronavirus 
Coronavirus updates: 🔹US reports 15th case of Covid-19, a person from Texas who travelled to Wuhan 🔹Japan records first death from Covid-19 🔹Three suspected cases quarantined in Kolkata, India 🔹US administration officials believe China severely underreporting disease extent
February 13 Updates on COVID-19 Outbreak 🦠MS Westerdam entered into Cambodia 🦠Rubio questioned the CCP‘s ability to respond 🦠Tedros will bring WHO in China to learn experience? ! That’s ridiculous ! https://gnews.org/113047/ via @Gnews202064
The best way to protect yourself from any virus, including COVID-19 (coronavirus) is to wash your hands, cough in your sleeve and stay home if you are sick. http://ow.ly/yptU50ylATD
Daily press conference on #COVID19 with @DrMikeRyan. #coronavirus 
NEW: 15th case of the coronavirus, now named COVID-19, diagnosed in Texas, CDC says. https://nbcnews.to/3bEhiNo
China reported a huge increase in new COVID-19 cases. Here’s why it’s actually a step in the right direction 
Deaths from the COVID-19 virus outbreak were following a predictable curve ⁠— until they spiked today. Here’s our updated graph of deaths. 
Unmasked: Experts explain necessary respiratory protection for COVID-19: Are respirators or masks better? http://ow.ly/QGZp30qhrE1
"US President @POTUS is a guest of India. He is here on an invitation from we the citizens of India. As the #coronavirus affects China&amp; neighbours in that region, we have to hope for US companies investing in India. Can we not protest against our own guest &amp; support our @PMOIndia"
Already, more than 1,100 lives have been lost worldwide. While we wait to discover the true impact of COVID-19, these are the things we can do to protect ourselves and our families. 
Don’t Worry, Everything is Fine..! #coronavirus 
Des chercheurs canadiens recevront 6,5 millions pour lutter contre le #COVID-19 (Canadian researchers to receive $6.5 million to fight COVID-19) 
WATCH LIVE: WHO gives updates on the coronavirus outbreak (COVID-19) https://bit.ly/39ujhBQ
Sudden Militarization Of Wuhan's P4 Lab Raises New Questions About The Origin Of The Deadly Covid-19 Virus 
As #coronavirus accelerates, World Health Organization continues its outrageous praise for #China government. What is going on here? Is WHO focused on combating the epidemic or appeasing Beijing? These inappropriate comments damage WHO credibility
"Administration sources say they believe China is under reporting the number of #coronavirus cases by at least 100,000 in China. Also sources say the administration believes China is ""severely"" under reporting the number of deaths from the virus."
"There remain no confirmed cases of #COVID19 in the African region &amp; readiness continues to be a top priority for Member States. @WHOAFRO is training technicians &amp; equipping laboratories to test for COVID-19. Our experts have been deployed to 8 high-risk countries. "
PAHO says it is preparing eight Caribbean countries for laboratory diagnosis of the new coronavirus (COVID-19). Training began in Suriname, followed by Barbados and Haiti, and will continue later this week in Jamaica, Belize and Dominica. 
58 confirmed cases of COVID-19 outbreak in Singapore
"Public health is also about clear communication. @WHO emails they’ll handle the awkward name SARS-CoV-2 like this: “Name of disease: #COVID19 Virus: named by the International Committee on Taxonomy of Viruses For simplicity, WHO will use ""the virus that causes COVID-19."""
Another person in the U.S. has been diagnosed with COVID-19, the respiratory infection caused by coronavirus, bringing the number to 14. Worldwide, the number cases has passed 60,000. https://wb.md/2OQR6Fn
LATEST: https://nbcnews.to/2SrUXuV • More than 15,000 new cases of the coronavirus (now named COVID-19) reported, bringing total number of cases to more than 60,000 • More than 1,350 total have been killed by the virus
Researchers are reporting that chest CT was able to detect COVID-19, the disease caused by the novel #coronavirus, in individuals with high clinical suspicion of the virus -- even in cases with negative initial DNA tests -- #Radiology #Imaging #CTRad
A company in Chongqing, China has built a tunnel to spray employees at an industrial complex with disinfectant before they begin work, according to local media, as the country battles the Covid-19 coronavirus outbreak. Visit http://bit.ly/CoronaUpdates for more Covid-19 news. 
Sudden Militarization Of Wuhan's P4 Lab Raises New Questions About The Origin Of The Deadly Covid-19 Virus 
Measures taken on campus after NUS professor contracts COVID-19 https://cna.asia/2tZLAco
Absolutely thrilled we keep @MattHancock at @DHSCgovuk , I am really loving his ambitious and much needed reforms - in particular on health tech to improve the Health Service and his compassionate response on COVID-19 is a credit to him and his team. 
#COVID19 UPDATE (February 13): The number of Filipinos abroad who had COVID-19 increased to 11. In Japan, they recorded their first fatality from the disease. Meanwhile, the global number of confirmed cases suddenly exceeded 60,000 today, as compared from about 45,000 yesterday. 
"#BREAKINGNEWS #Coronavirus #London COVID-19 patient took #Uber minicab to A&amp;E When the patient ""self-presented"" they were immediately given a face mask and taken to a special area to be tested for the virus"
Chest CT was able to detect COVID-19, the disease caused by the novel coronavirus (2019-nCoV), in individuals with high clinical suspicion of the virus -- even in cases with negative DNA tests, according to researchers from China. http://bit.ly/37n1knt #radiology
India has stocked enough medicines, other necessary requirements to tackle COVID-19, says Harsh Vardhan Read @ANI Story |https://www.aninews.in/news/national/general-news/india-has-stocked-enough-medicines-other-necessary-requirements-to-tackle-covid-19-harsh-vardhan20200213192726/
San Diego lab discovers COVID-19 vaccine in 3 hours | http://cbs8.com
"Coronavirus: London COVID-19 patient took Uber to A&amp;E | UK News | Sky News https://news.sky.com/story/coronavirus-face-mask-shortage-threatens-uk-dentists-11933071"
"#AMQuickie: Feb 13, 2020 - Democratic candidates seek union endorsements - Coronavirus disease named COVID-19 - Racist cops frame whistleblower + more #leftisbest headlines SUBSCRIBE—&gt; https://fans.fm/amquickie/subscribe"
Coronavirus: China’s fear of mass job losses looms large as Covid-19 takes toll on economy 
"Graphic on COVID-19 deaths on CNA TV news bulletin wrong; corrected immediately on air https://cna.asia/38k29yx"
"🚨BREAKING: #China reports 15,152 new #coronavirus cases, a *10-fold jump* in 1 day due to new diagnostic criteria. The total “confirmed” cases is &gt;60,000, but the *actual* number is MUCH higher. This isn’t ending anytime soon... @thespybrief #COVID19"
Changi Airport steps up cleaning, hygiene measures in light of COVID-19 concerns https://cna.asia/31OKdcM
Coronavirus outbreak: Why the number of COVID-19 cases has suddenly shot up 
#Uyghur #Muslims continue to be humiliated by the #Chinese Regime. The sign around their necks read: “We didn’t follow official orders to stay indoors, instead we went outside and walk around aimlessly like donkeys” #coronavirus #CoronaCamps #VirusThreatInCamps #CloseTheCamps
The Cordillera Administrative Region remains free of the novel coronavirus infection or COVID-19 as all of the people kept under watch tested negative for the new viral disease, a health official says. 
"The first person confirmed to have #coronavirus in London took an Uber to hospital and walked into an A&amp;E department https://news.sky.com/story/coronavirus-face-mask-shortage-threatens-uk-dentists-11933071"
So apropos given the COVID-19 situation. It's going to matter to the market a lot more than it has so far. When that happens is uncertain. 
The top CPC discipline authority has urged strict law enforcement in the #COVID-19 battle, and officials who fail to fulfill their duties must be held accountable. More efforts should be made to correct bureaucratism and formality for formality’s sake in #Wuhan and #Hubei.
It appears that what happened is Chinese travelers infected with Covid-19 passed it to a taxi driver in Tokyo, and he in turn infected his mother-in-law in her 80s. She was in the hospital since February 1 and died today, only now confirming her coronavirus infection. (MP) #Japan
My first story for @washingtonpost is on #HongKong #ProtestArt, which took a new turn amid #coronavirus epidemic. Themes and topics might have changed, but the target remains the same, HK leaders - with #CarrieLam as an all time favorite.
There are now 11 Filipinos who have tested positive for for COVID-19 aboard the Diamond Princess cruise ship that was quarantined in Japan's Yokohama port. 
ugh this IU necklace so pretty.. i hope will stil be there when i go to korea (covid-19 magflop ka na) but it is limited edition so probably will be sold out again very quick ☹️ 
"Caixin - ""A bullet train cleaning staff member tested positive for the new coronavirus, now known as Covid-19, fueling fears that the virus might have been spread to passengers on more than a dozen trains."" https://www.caixinglobal.com/2020-02-13/coronavirus-latest-since-feb-1-confirmed-cases-14380-in-china-canada-starts-limited-evacuation-but-no-travel-ban-101510591.html"
Chinese health authorities on Thursday said it received reports of 15,152 (including 13,332 in Hubei) new confirmed cases of novel coronavirus (COVID-19) infection and 254 deaths. STORY: https://www.untvweb.com/news/china-reports-15152-new-confirmed-cases-of-novel-coronavirus-infection-254-new-deaths/
LATEST: Confirmed cases of coronvirus, now named COVID-19, reach nearly 60,000 in China. https://nbcnews.to/2vsWHuD
"Japan confirms 1st COVID-19 death 80 yr old woman with no travel history to China &amp; no known contact with confirmed case, died of COVID-19. SARI screening, can help to pick up unlinked COVID-19 infections, which suggests undetected local transmission. "
The World Health Organization (WHO) says it’s too early to make any predictions on when the novel coronavirus, now officially called COVID-19, will be contained 
More than 10.000 people in the Son Loi district in Vietnam, near the capital Hanoi, have been quarantined as of Thursday because of the coronavirus (COVID-19). https://nationoverload.com/vietnam-quarantines-10-000-people-first-big-quarantine-outside-of-china-because-of-coronavirus/
Dawu county of Xiaogan city in Hubei Province launches the wartime control order for better controlling the ongoing #COVID-19 outbreak following the country's first wartime control order from Shiyan. 
In the first mass quarantine outside of China, more than 10,000 people in villages near Vietnam's capital were placed under quarantine after six cases of COVID-19 were discovered in the area. 
BREAKING: Perioperative Considerations for the 2019 Novel Coronavirus (COVID-19) by @lianazucco, Nadav Levy, Desire Ketchandji, @DrMikeAziz, @rsatyak Includes a downloadable infographic! #ptsafety #patientsafety #anesthesia #coronavirus #FOAMed
Russian taxi driver gives no chance to #coronavirus 
"VIDEO: Fears of the COVID-19 virus have dampened the mood ahead of Valentine's Day, with one florist in Shanghai lamenting the lack of orders. ""Some people asked me if they can spray disinfectant on the flowers. I said definitely not,"" says the florist "
#CORONAVIRUS LIVE UPDATES: (MAP) - 60,000 Infected, - 1,357 Deaths Globally, - 14 U.S. confirmed infected 
A 2nd citizen journalist in China reporting on the #coronavirus outbreak in Wuhan has stopped posting on social media and answering his calls. Activists say he has disappeared 
"""In nine pregnant women with laboratory-confirmed #COVID-19 pneumonia, samples from their infants, including amniotic fluid, cord blood, and a neonatal throat swab, tested negative for the virus"" "
It took CBC, 10 mins this am to discuss what’s happening. COVID-19, Bombardier, hockey were all more important. #DefundCBC
The disease caused by the novel coronavirus now has an official name: COVID-19 
44 More COVID-19 Cases On Japan Ship. https://www.channelstv.com/2020/02/13/44-more-covid-19-cases-on-japan-ship/
[Infographics] COVID-19 situation update as of Feb 13 #COVID19 #COVIDー19
Health Minister @drharshvardhan briefs media on Novel #Coronavirus (COVID 19) Surveillance at Points of Entry is continuing at 21 Airports, 12 major ports, 65 minor ports and at 6 land crossings. Read here: https://pib.gov.in/PressReleasePage.aspx?PRID=1603070#
14th case of new coronavirus, COVID-19, confirmed in the U.S., CDC says. https://nbcnews.to/31NRl9x
Ministry of Health and Family Welfare: On the directions of PM, a high-level Group of Ministers (GOM) constituted to review, monitor&evaluate preparedness&measures taken regarding the management of Novel Coronavirus (COVID-19) in the country. 
This week, @WHO announced guidelines for women who are pregnant or breastfeeding during an Ebola outbreak. This is particularly timely given the new outbreak of coronavirus, COVID-19, the Lassa Fever outbreak in Nigeria and the latest outbreak of Ebola in the DRC. #ThriveThursday
US Must Prepare for Thousands of COVID-19 Cases in Coming Weeks, Experts Warn 
High-level Group of Ministers reviews current status, and actions for prevention and management of Novel #Coronavirus (COVID-19) A total of 2,315 flights screened covering a total of 2,49,447 passengers. #CoronavirusOutbreak @MoHFW_INDIA Details: https://pib.gov.in/PressReleasePage.aspx?PRID=1603053#
Garuda has grounded a plane that flew from Denpasar to Shanghai on Jan 28. The plane, designated GA858, carried a passenger that was later confirmed to have contracted COVID-19. The same person arrived in DPS from Wuhan on Lion Air flight JT2618 on Jan 22.
JUST IN: Japan announces first death of person infected with COVID-19 | via @AFP
Malaysia confirms new COVID-19 case related to two others who had tested positive 
The spike in Covid-19 infections and deaths is a non-story. The Chinese widened their definition of definite Covid-19 infection by allowing widely available clinical tests in addition to less available DNA tests. This allows more deaths to be attributed to Covid-19. Wait and see.
Read the full message by NUS President Prof Tan Eng Chye at http://nus.edu/2UMvhdJ. Our University's precautionary measures implemented to safeguard our community against the COVID-19 are at http://emergency.nus.edu.sg.
BREAKING: Japan health ministry confirms first death related to COVID-19: a Kanagawa Prefecture woman in her 80s
So the new disease is called COVID-19, but the virus has been named SARS-CoV-2. Confused? Here's my story about how it happened. 
I'm intrigued by the politics behind renaming the Wuhan Corona virus. COVID-19 is such a cute, almost antiseptic name. Why didn't this same dynamic play out for the Ebola virus? Or Lassa fever?
Xiaogan, Huanggang and other places in Hubei to implement the same level of quarantine and medical treatment measures as #CODIV19 epicenter Wuhan amid the COVID-19 outbreak: center govt's working group in Hubei 
CDC DIRECTOR ROBERT REDFIELD tells STAT's Helen Branswell that there are likely to be MORE CASES of human-to-human transmission of the new coronavirus (COVID-19) in the U.S. It's not going to be possible to seal the country off from the virus. #wtpTEAM
Big spike in Covid-19 with cases nearing 60,000 worldwide @AFP
The DOH in Bicol announced on Thursday (Feb. 13) that Bicol remained free of the corona virus disease (COVID-19) after five persons, who had been watched for infection, tested negative for the virus. | @msarguellesINQ
Myanmar Red Cross Society, Red Cross Volunteers educated the communities about COVID 19 virus, informed people how to stay healthy and posted the posters and delivered strategic preparedness for COVID 19 virus released by MOHS in Kyauk Takhar Township, Bago Region @ThankYouRCV 
Amid fears of 80% revenue loss due to COVID-19 outbreak, restaurants hope for rent rebates https://cna.asia/31Owoeu
"Some passengers to be allowed to disembark Diamond Princess cruise ship; 44 more test positive for COVID-19 "
Caixin does it again: they discovered the first time Covid-19 patients visited hospitals in Beijing was on 01.12, Guangdong 01.04, Shanghai 01.15. All were only announced when Zhong Nanshan said the virus could spread person-to-person on 1.20 
83 people are now being allowed to return home after being held in quarantine in Merseyside after testing negative for COVID-19, the disease caused by the coronavirus 
LATEST: China's Hubei province sees a jump in cases of new coronavirus, now named COVID-19, as the diagnosis method changes with 14,840 new cases reported Thursday. (typo corrected in 'COVID-19') https://nbcnews.to/31S9SBi
The first case of coronavirus has been diagnosed in London. Here's everything you need to know about protecting yourself from COVID-19. 
.@drharshvardhan briefs the media on Novel Coronavirus (#COVID 19). “Political commitment at the highest levels leading the government’s response”. https://pib.gov.in/PressReleaseIframePage.aspx?PRID=1603070
Sudden Militarization Of Wuhan's P4 Lab Raises New Questions About The Origin Of The Deadly Covid-19 Virus | Zero Hedge https://www.zerohedge.com/geopolitical/sudden-militarization-wuhans-p4-lab-raises-new-questions-about-origin-deadly-covid-19 | @ZeroHedge got @Twitter banned in China for starting this thread 10 days ago, now the details emerge .....
"Canadian research officials return from Geneva with plan to tackle COVID-19 https://www.ctvnews.ca/health/canadian-research-officials-return-from-geneva-with-plan-to-tackle-covid-19-1.4809779?taid=5e452c4a035a2400014b5108&amp;utm_campaign=trueAnthem%3A+New+Content+%28Feed%29&amp;utm_medium=trueAnthem&amp;utm_source=twitter"
This report goes along with everything we discussed in Part 2 of Burgeoning Asian Bioweapons. Worth a read. Sudden Militarization Of Wuhan's P4 Lab Raises New Questions About The Origin Of The Deadly Covid-19 Virus https://www.zerohedge.com/geopolitical/sudden-militarization-wuhans-p4-lab-raises-new-questions-about-origin-deadly-covid-19
This man started to sneeze and cough. Islamicat decide, is better safe than sorry #coronavirus 
#COVID19 #COVID2019 #COVIDー19 #COVID_19 #COVID_2019 #Coronavirus #2019nCoV #Wuhan #China #WHO #SARSCoV2 Attention! Media and WHO spread fake news around the world! FALSE: Virus Name: Covid-19 CORRECT: Virus Name: SARS-CoV-2 CORRECT: Lung disease Name: Covid-19
Number of Pinoys on cruise ship found positive for COVID-19 rises to 11 
Jiangmen, Guangdong Prov.has 5 county admins and home to millions of overseas Chinese across the world. The pictures show donations of 650000 masks to China to fight COVID-19 coordinated by Seattle based Wuyi (5counties) Youth Association. They're good my friends! Great job! 
One can't help wondering with evidence of COVID-19 now seeming to have a presence in Bali just how big a risk we are taking allowing 1000's of Australian tourists to travel back to Australia after mingling with the multitudes of Chinese tourists allowed to holiday in Bali.Risky!
Update: Two new cases of COVID-19 have been reported in Japan 
"Some #GoodNews: Chinese doctors published @TheLancet on 9 women infected with SARS-CoV-2 &amp; contracted COVID-19. All delivered by C-sections, no severe disease, babies all well. 1918 flu pandemic (pregnant women: 37% mortality), H1N1 2009 (📈complications). https://www.thelancet.com/action/showPdf?pii=S0140-6736%2820%2930360-3"
"ICYMI: The WHO cautioned it was ""way too early"" to say whether COVID-19 might have peaked or when it might end #coronavirus "
Pakistani COVID-19 patient cured and discharged from hospital in #Guangdong. http://bit.ly/2Skbfpk
All 118 patients quarantined in Milton Keynes, UK test negative for COVID-19 More in our #COVID19 live blog below:
Union Health Minister Dr Harsh Vardhan on COVID-19: Ship Diamond Princess (of Japan) has been quarantined. 2 Indian crew members on board the ship tested positive. The Ministry of External Afrrais is keeping a close watch on it 
Union Health Minister Dr Harsh Vardhan on COVID-19: All 402 people kept in ITBP quarantine facility have tested negative and their condition is stable. #coronavirus 
The only patient infected with the novel #coronavirus (COVID-19) in southwest China's Tibet Autonomous Region is discharged from hospital after an 18-day treatment 
Gold is higher in London on Thursday morning, holding gains seen late in US trading after a jump in the number of COVID-19 cases reported. Last around $1574-75/oz. 
GSMA Cancels Mobile World Congress 2020 Due to COVID-19 Outbreak #MWC2020 #MWC2020Cancelled #coronavirus #COVID-19 
"""Bro, why are you so busy because of COVID-19 when you are not even a medical researcher?"" ""Because I'm a social media trainer and my main topic is fake news. While they are solving COVID-19, I'm trying to solve STUPID-20"" #stopsendingunverifiednews #keepcalm #dontfearmonger"
"In Brussels meeting with Health Commissioner, Commissioner for EU Crisis Management & EU Health Ministers on coronavirus/Covid-19 &amp; how we work together at EU level to protect citizens. Viruses know no borders &amp; whilst epicentre remains in China, it is important to colloborate "
Daily Updates of COVID-19 figures in China. 59804 confirmed, 13435 suspected, 1367 deaths, 5911 recovered. New confirmed cases outside Hubei continue to decline. The surge of new confirmed cases in Hubei is due to new classification(trial version 5). (see previous tweet) 
