Please all come back safely! A total of 11,921 health workers from cities and provinces across China were sent to help fight the novel #coronavirus outbreak in Hubei province, as of Feb 9. 
Official News reports: latest Levels of sulphur dioxide is high in Wuhan, China, caught by a satellite. This could be due to burning of large number of Body #coronavirus #corornavirus #coronavirusarv #CoronellVirus #China #WuhanVirus
Chinese researchers develop robotic sprayers that can help reduce the transmission of the novel #coronavirus in heavily populated urban areas http://xhne.ws/RKNAe
"""I'm afraid that the #coronavirus could actually be the single biggest threat to both global and U.S. growth this year,"" says @SenTomCotton. ""What really spreads fear is China lying about the origins of this disease and about the number of people who have it."""
"Confirmed #coronavirus cases: 🇨🇳 42,268 &amp; 1,011 dead 🇯🇵 161 🇸🇬 45 🇭🇰 42 &amp; 1 dead 🇹🇭 32 🇰🇷 27 🇹🇼 18 🇲🇾 17 🇦🇺 15 🇩🇪 14 🇻🇳 14 🇺🇸 12 🇫🇷 11 🇲🇴 10 🇬🇧 8 🇦🇪 8 🇨🇦 7 🇵🇭 3 &amp; 1 dead 🇮🇳 3 🇮🇹 3 🇪🇸 2 🇷🇺 2 🇰🇭 1 🇫🇮 1 🇳🇵 1 🇱🇰 1 🇸🇪 1 🇧🇪 1 Infected: 42,729 Deaths: 1,013 #CoronarvirusOutbreak"
Quarantine or illegal detention of the whole building? #coronavirus #CCP is terrorism.
#Coronavirus fight: Hundreds of trucks were dispatched to spray disinfectants overnight in Luoyang, China. #FightVirus
Another crazy scene in Communist China. #CCP is taking advantage of the #coronavirus breakout, implementing cultural revolution 2.0! 
Every chance of going out needs to be cherished during the #coronavirus outbreak in #China. This time the woman used the chance of dumping trash to practice #kungfu sword.
Breaking - According to @CCTV, the Central Government’s task force for handling #coronavirus epidemic is now questioning the deputy mayor of #Wuhan and another high level official after the television station exposed how works related to transferring patients with severe ...
Naming someone who unknowingly contracted & spread #coronavirus is irresponsible. Sounds like this individual took appropriate measures when they found out they were a risk. For the latest advice check out @PHE_uk:
"JUST IN: 2 new #coronavirus cases confirmed in Singapore; a Bangladesh work pass holder and a Resorts World Sentosa Casino worker http://cna.asia/39oaUaY"
"""At this moment, we are very scared."" The Indian crew members on the quarantined #DiamondPrincess cruise ship are asking Prime Minister @NarendraModi for help as they remain stranded in Yokohama, Japan #クルーズ船 #CoronavirusOutbreak #coronavirus "
"""China is hiding the real numbers of deaths"" WION News (India) This report also notes the increased SO2 concentration around #Wuhan detected by satellite, which could be attributed to the burning of a large no of bodies &amp; medical supplies. #coronavirus https://twitter.com/Rntk____/status/1227195680520888320/video/1"
Dear KLM @KLM Today, you made it quite clear that you discriminate against race. Using Corona Virus as an excuse. You owe my friend and Korea a HUGE apology. #CoronaVirus #Racism #KLM https://twitter.com/hyunmoyang/status/1227087799746064384
#coronavirus: 1 - airborne 2 - up to a 24 day incubation period 3 - lives on surfaces for up to 9 days 4 - no vaccine 5 - ~20% serious complication rate 6 - completely uncontained 7- laid waste to global supply chains But, sure, go ahead and jam stocks to all-time record highs.
Remember anyone hiding behind the #coronavirus to justify their fear of Chinese Australians were racists to begin with. Now we need to find a way as a nation to care more about how we are racist rather than being called one. We need dialogue, education and engagement to do better
Novel Coronavirus (2019-nCoV) advice for the public: #MythBusters #coronavirus What precautions should i take while travelling? (2019-nCoV)? Courtesy @WHO
"""Chinese scientists made the genetic sequence of #coronavirus in a record quick time,"" says Dr. Robin Shattock who is developing a vaccine. ""We've moved into animal testing this week and we hope to move to human testing within a period of months."" "
A man who has had #coronavirus through no fault of his own. What does @skynews and @adamboultonSKY do. Name him and label him as a #SuperSpreader 🤷🏼‍♀️ Reputation ruined in two words. The media are a disgrace
Trying to stay away from #coronavirus as a topic, but I did see an #OANN interview with a Chinese Healthcare worker who claimed numbers were being understated and were at least 10x higher than official reports. That was about two weeks ago. 1013 likely very low.
"""We need a Manhattan Project level effort to work with our best research scientists in laboratories in this country to develop a vaccine as quickly as possible"" Manhattan level!! #coronavirus "
"The mental well being of citizens in #China under lock-down is becoming a serious concern as videos emerge showing them throw away money out of desperation, unable to move about freely &amp; access basic amenities money is now useless #nCoV2019 #WuhanCoronavirus #CoronavirusOutbreak "
"#NorthKorea Closes Borders With #China &amp; #SouthKorea Over #Coronavirus Fears."
All you need to know about the #Coronavirus. Issa Thread Watch both videos Kindly retweet 
".@SecPompeo &amp; @SecAzar on addressing the #coronavirus: We’re undeterred in our vigilance to protect our people. And we’re mobilizing resources around the world to help other nations fight the disease, too. This is American altruism at its finest. https://bit.ly/2OLR95n @USATODAY"
These are the heroes of Wuhan. This is the story of the volunteers who are risking their own health in order to save others. #askWHO #knowthefacts #coronavirus @WHO @jameschau
#Filipinos Turn on Duterte as #Coronavirus Fears Spread Anti-#Chinese and anti-#American conspiracy theories have followed the first death Duterte’s perceived reluctance to respond quickly to the virus, led the hashtag #OustDuterte to trend on Twitter
Chinese students attend flag-raising ceremonies from home amid #coronavirus outbreak. #StayStrongChina
"A new disinformation war just started. The US elections is coming. So Steve Bannon is back. And he has a new enemy - #China. Now he wants to use the #Coronavirus - calling it the ""biological Chernobyl"" - not just to destabilize China but to infect the American political body. "
Coronavirus claims first Adventist: Church members are asked to pray and show Christ-like compassion. #coronavirus #pray https://www.adventistmission.org/coronavirus-claims-first-adventist
JUST IN: Novel #coronavirus 'very grave threat' for the world: WHO chief | via @AFP #nCoV
#Coronavirus outbreak | 🇪🇺 EU health ministers will meet on 13 February for an extraordinary Council. On their agenda: joint solutions to prevent the spreading of the outbreak within the EU. More info here: https://europa.eu/!BJ34vw #EPSCO
"#CCP robbery big time!! The #Guangdong Provincial People’s Congress, just passed an Emergency Law: #Guangzhou &amp; Shenzhen Govts can DIRECTLY acquire personal properties, assets, cash, food, supplies...anything that is needed to help contain #coronavirus. . "
A disinfection passage in China's Shanghai can kill 99% of viruses in 20 seconds to help battle the #coronavirus outbreak 
"""You cannot shut down the world."" The World Health Organization on Tuesday said canceling events such as international conferences are not always necessary amid the spread of the novel #coronavirus. #nCoV"
Find out the latest updates on the outbreak of #coronavirus in China, including the current situation in the UK and information about the virus and its symptoms. https://gov.uk/coronavirus
A welcome slowing in number of cases of #coronavirus @Gavekal
"""I believe the worst can still be prevented."" While there are tough decisions ahead, sharing research data with @WHO is essential to stop the new #coronavirus. Read more from @JeremyFarrar in @SPIEGEL_English | #OutsmartEpidemics"
#JUSTIN: Infectious disease expert Prof. Yuen Kwok-yung admitted that govt’s efforts lagged behind when #HongKong had its first imported #coronavirus case. “... best to reduce flow control at borders asap but govt has its own difficulties.” // 49 confirmed cases w 1 death now. 
Many ordinary Chinese people, such as deliverymen, police officers, factory workers and volunteers, are contributing in their own ways to support the medical staff in this battle against novel #coronavirus. 
#coronavirus,#Coronavirustruth,#corornavirus,after 14 boring days cant going outside to play around,what'll u do when getting a chance to throw garbage?of course!FREE URSELF!
I was on @BBCBreakfast this morning talking #coronavirus If you think you may have come into contact with someone who has it or returned from an at risk country STAY AT HOME and ring 111 Also @louiseminchin was perfect at catching her sneeze in a tissue and throwing it away!
"""No occasion for panic"" Newspaper in 1918 trying to downplay the Spanish Flu, which ended up killing 50 million people. #Coronavirus "
What's it like in local communities in Wuhan, China, as the city is fighting novel #coronavirus? Follow Xinhua reporter Xu Yang to explore residential units in a community and witness impact of the epidemic 
"#ChinaVirus — 🇨🇳Guangdong just passed emergency law to *authorise Govt to requisite any #private properties* including houses, facilities &amp; material supplies to fight #coronavirus in #China. Notably it’s FIRST time after enforcement of PRC Property Law in 2007. #相信政府 #物權法"
Trucks used to spray disinfectant have been patrolling the streets of #Wuhan since Sunday. Local authorities are scheduling these trucks in the city twice a day to contain the spread of the virus. #coronavirus #China
Novel ways to control the novel #coronavirus outbreak. Here's how China has been using AI technology, drones and robots in its battle against the virus 
Pakistan has decided to extend cooperation with the war-torn Afghanistan, allowing free of cost tests for the suspected #coronavirus patients, a virus that has already claimed more than 1000 lives in neighbouring China. #ARYNews
Taiwan's (democratic) government: under-promise, over-deliver. Hong Kong's (semi-authoritarian) government: no promise, no delivery. #hongkong #coronavirus 
Japanese artist @meetissai known for turning viral animal pics into funny sculptures has made a sculpture of this cat in a mask in response to the novel #coronavirus outbreak. 
When you’re stuck at home because of #coronavirus lockdown 
I just have to post this for Baba Suwe 🤣🤣🤣🤣 . This guy is a comedian #NairaMarley Ajah #CoronaVirus #RudeBoyXMercyEke #ValentinesDay #FIFA #999EP 
#Death toll has exceeded 1000 in China, with 45k confirmed infected. On monday 108 new deaths was the largest number of deaths on a single day. Numbers have tripled in the last week. #coronavirus https://twitter.com/Newsreportcom/status/1227148529769934849/video/1
Meanwhile, two of the three Indians infected with the virus in Kerala are free of the infection and have tested negative, state authorities said. #Coronavirus 
How the China government treated Dr Li Wenliang. He was arrested and accused of spreading hoax and was forced to sign a letter dictated by the government. Dr Li Wenliang died from #coronavirus 
He was silenced by Chinese authorities for warning against the #coronavirus outbreak, and soon died from the illness. This is the story of Dr. Li Wenliang. #FreedomOfSpeech #CoronaVirusTruth #CoronaVirusOutbreak 
Live: First batch of cured #coronavirus patients discharged from a makeshift hospital in Wuchang 
How to calm the public at the time of crisis - provide update regularly - be honest / don’t hide facts - share the actions taken - apologize (if you have to) - don’t blame others I think @DrDzul is managing the #CoronaVirus issue very well. Should emulate it at our workplace.
Dozens of people were quarantined at a #HongKong housing complex. Two people living on different floors were found to be infected with the #coronavirus as virus appeared to spread through the building’s pipes.
Cars driving into Beijing have to scan a QR code hanging from a drone before entering the city. #coronavirus 
If a GOVT makes a MOTHER cry, it will pay a certain price & be crushed sooner or later. China has detained over 3 million #Uyghurs in #ConcentrationCamps. Once the #coronavirus penetrates into those camps....who knows what will happen...@rushan614 @hrw @shujamtaro @IntyMedia
China’s #coronavirus death toll has exceeded more than 1,000. Read the latest on the outbreak: https://aje.io/bmk32
Novel Coronavirus (2019-nCoV) advice for the public: #MythBusters #coronavirus Can pets at home spread the new coronavirus (2019-nCoV)? Courtesy @WHO
Live: The joint prevention and control mechanism of China's State Council briefs on #coronavirus updates 
#Cuba 's unique medicine Interferon Alpha 2B is one of several being used in #China to successfully cure those infected with the #coronavirus 
"First confirmed case of #coronavirus among U.S. evacuees from China diagnosed in person at Miramar Marine base in San Diego; infected person is displaying only minimal symptoms, health officials say "
Latest reports show that the incubation period of the #coronavirus is up to 24 days, not 14 as originally thought. That kinda makes all the 2 week quarantine efforts useless doesn't it? https://www.straitstimes.com/asia/east-asia/coronavirus-new-study-finds-incubation-period-of-up-to-24-days
According to #YonhapNewsAgency, #SouthKorea will officially list both #HongKong and #Macau as #Coronavirus infected areas starting from tomorrow. How do you feel #CarrieLam? That’s what you want, bundle Hong Kong with PRC, infect all civilians?
This is how he says he’ll fight the #coronavirus ..... https://twitter.com/trashcan_b/status/1217197297311920128/video/1,
Hong Kong business people donated over HK$1.11 billion to help mainland fight coronavirus, Beijing’s office says https://www.hongkongfp.com/2020/02/11/hong-kong-business-people-donated-hk1-11-billion-help-mainland-fight-coronavirus-beijings-office-says @krislc #HongKong #China #coronavirus #ChinaCoronaVirus #CoronavirusOutbreak
Foreign artists living in China during the outbreak of the novel #coronavirus pneumonia have recorded a version of #MichaelJackson’s #YouAreNotAlone with new lyrics to show their support for the fight against the epidemic. #NCP
When they see ANY Chinese #coronavirus 
Many thanks to our iron brother #Pakistan! Thank you for your active support when we are facing difficulties #coronavirus. Best wishes to #Pakistan. Long live the brotherhood! 🇨🇳🇵🇰
During the isolation period in China, a young girl was taking out trash with a sword in her hand. 🅻🅾🆅🅴 🅸🆃❤ repost from Weibo #coronavirus 
Baba Suwe 🤣🤣🤣🤣 if you don't understand Yoruba olease tell a friend to translate for you. #NairaMarley Ajah #CoronaVirus #RudeBoyXMercyEke #ValentinesDay #FIFA #999EP
It's a long way home for #Hubei truck driver Xiao Hongbing, who has been driving on a highway for two to three days during the #coronavirus outbreak, trying to get back to the sealed-off province. He was touched by the help of a nice traffic police officer in Shaanxi Province. 
How #Wuhan hospital workers work amid #CoronavirusOutbreak? 
Cat's can't get nor give #Coronavirus but this is cute. 
Singapore’s MOH claims there is no evidence of aerosol #coronavirus transmission, citing Chinese CDC expert. Yet Shanghai official contradicts this from 2 days ago. Hmmmm, jury is still out on this airborne thing. Though they agree respiratory droplets 💧are transmission route. 
Compare this to W’s response to SARS, which was to increase US funding for global health assistance #coronavirus #publichealth #pandemic #WuhanVirus #IMPOTUS #republicans #resist https://tinyurl.com/u7t44bp
“The world is watching the heroic struggle of #Wuhan and #China against this epidemic,” says former President of Slovenia @_DaniloTurk. As rapid urbanization and global warming are creating conditions for new viruses, it is high time for international cooperation. #coronavirus 
After health officials partial evacuated residents from a building in #TsingYi due to 2 confirmed #Coronavirus cases happened in the same block. A resident said she was asleep and missed the evacuation 4 out of 3 households have showed symptoms of infection. #HongKong @rthk_news
Liz might as well have had #Coronavirus the way she was shunned by voters in this cafe 🤣 You *almost* feel sorry for her. 
CCTV on Jan 1: #LiWenliang is one of the “netizens who spread untrue info and caused harm to the society.” CCTV on Feb 7: “He sounded alarm early on about the #Coronavirus...” 
"To avoid cross-infection and save time, #coronavirus-fighting medical workers voluntarily cut their hair short. ""Hair can grow longer again. The priority now is to protect myself and do my best to save more people,"" a nurse said.❤️ "
Streets are being sprayed around China. #coronavirus #coronavirusprevention
Google is deliberately censoring any anything #coronavirus related. Why is this so? 
#coronavirus OMG person suspected of having the virus in Romania is being quarantined 😱😱 I hope that stretcher is shock-proof! https://twitter.com/1copac/status/1225859154868305920/video/1
Hong Kong gov’t says no plans to enact laws to control supply and prices of surgical masks https://www.hongkongfp.com/2020/02/11/hong-kong-govt-says-no-plans-enact-laws-control-supply-prices-surgical-masks @krislc #HongKong #China #coronavirus #ChinaCoronaVirus #CoronavirusOutbreak
#WeStandWithChina: My #SandArt with the message, Fight against #CORONAVIRUS at Puri beach, #Odisha #india
As at this morning, nearly 43,000 people are infected by #coronavirus. As of Monday evening, at least 1, 018 people have died. No cases yet confirmed in the Motherland. 
The Iranian government says that no one in Iran has contracted the corona virus. However, there are reports of suspected cases and the authorities are failing to take the necessary precautionary measures to stop the virus from spreading. #Iran #CoronaVirus 
Longings & call of duty: The policeman was surprised to see his wife who came to deliver a package, but to avoid possible infection they were compelled to keep a distance from each other. He hasn't been home for several days, as he is duty-bound to fight against #coronavirus #NCP
Coronavirus death toll passes 1,000 as China attempts to contain epidemic https://www.hongkongfp.com/2020/02/11/coronavirus-death-toll-passes-1000-china-attempts-contain-epidemic #China #coronavirus #ChinaCoronaVirus #CoronavirusOutbreak
1/2 Singapore appears to have sustained community transmission of #coronavirus and may be 3-4 weeks ahead of what could unfold in U.S. Both nations should have similar number of imported cases, but Singapore density will make spread manifest more quickly. 
"#HongKong Chief Executive Carrie Lam says people under home quarantine over #coronavirus should call a government hotline ""if they need to go out"". "
Disinfection work in full swing in #Hubei to contain #coronavirus 
BTW for everyone holding out hope that warmer weather will kill the #coronavirus... guess what happens when summer comes in the Northern Hemisphere? Ba-boing! Winter arrives in the Southern Hemisphere! #China #Australia #Argentina #Chile #NewZealand #SouthAfrica
WATCH a viral video of Changzhou police telling people to “stay at home” in Mandarin Chinese, the local Changzhou dialect, English, and Japanese to encourage residents to stay indoors amid #CoronavirusOutbreak. 
2/10 #coronavirus Do not underestimate in a society without ROL and media supervision, what can “law” enforcement turn to. Policemen will take advantage of this “ special situation” to abuse their power to release the darkness in their characters. A broken and sick society❗️❗️ 
This photo collage of scenes fr last night’s #coronavirus fear evacuation has been going ard. Q: why do Hong Kong police have full gear but medical staff r in the most basic stuff? 
"The incubation period for the #coronavirus can be as long as 24 days, according to the largest study analyzing the disease. The researchers conclude that the ""2019-nCoV epidemic spreads rapidly by human-to-human transmission."" "
"#China official #coronavirus NoS continue to rise: dead 1017; definitely infected 42,708; additional cases prob infected 21,675; recovered 4000. Good news is that, outside #Hubei Province, the infected rate has now dropped for 7 days. Inside #Hubei, esp #Wuhan, sounds terrible"
A beautiful girl is harassed and threatened by two CCP policemen for not wearing a mask. Can they do that? Human crisis. One girl is in danger, every girl is in danger. #coronavirus #CCP
Crows crowded on the Wusi Road, Chengxi District, Xining City, Qinghai Province. Crows love dead animals, like carrion. It looks like the movie Resident Evil. #coronavirus 
A dance therapy: Patients and doctors at a makeshift hospital in Wuhan enjoy a square dance, an effective way for sound mental health during this tough period of anti- #coronavirus battle. #NCP
The total number of confirmed cases of the 2019 novel #coronavirus reported from mainland China 🇨🇳 to date is 42,638. This includes 7,333 severe cases and 1,016 people who have died. #nCoV #nCoV2019 #2019nCoV
A much watch. Too much information revealed! Exclusive: Wuhan funeral home staffer reveals real death toll of #coronavirus 
#coronavirus 1 man did infect a lot of people. 
"Among Trump’s proposed 21% chop to the #foreignaid budget -&gt; steep budget cuts to global health programs, while #coronavirus spreads. Via @RobbieGramer @columlynch"
trump is unfit to lead - he should be impeached for firing the Vindman brothers #VindmanIsAHero #CoronavirusOutbreak is real - #TrumpIsAnIdiot
People were paying tribute to the late whistleblower Dr. Li who tried to warn the public about the danger of the #coronavirus, also the Chinese government will pay 100K USD to the Dr. Li's family for the loss of Dr. Li's life. 
"We are just 42 days into 2020 and already had 7 women killed by male violence in Australia. If this many Australians were killed by #terrorism or the #coronavirus in that time @ScottMorrisonMP would be speaking of nothing else but when its #DV we just get more silence &amp; inaction"
China - 2019-nCov case numbers are now worthless because the government is not counting lab confirmed asymptomatic cases - February 7, 2020 https://flutrackers.com/forum/forum/-2019-ncov-new-coronavirus/china-2019-ncov/828698-china-2019-ncov-case-numbers-are-now-worthless-because-they-are-not-counting-lab-confirmed-asymptomatic-cases-february-7-2020 #coronavirus #2019nCoV
Super weird - several individuals on a Paris takeoff flight bound for Shanghai were diagnosed with the #Coronavirus— in the opposite travel direction of the outbreak epicenter. Hmmmm, there must be more to this story somehow 🤔. 
"The WHO are ""blindsided"" that the CCP have not been reporting positive asymptomatic cases. Which is the majority of cases in influenza, people at home, recovering alone. This means the total infected is probably at least 10-25x higher and the spread that much wider. #coronavirus "
Looks like the Chinese aren't happy with those hospitals that they built in 2 weeks for sick with the #Wuhan #Coronavirus. Still looks like a healthier place than that #DiamondPrincess cruise ship in Japan.
they’re taking peoples temperatures before you walk into the restaurants and hotels here it’s crazy #coronavirus
A cruise ship in #Japan had been holding #coronavirus patients! After a quarantine over 50 people on board had been diagnosed with the disease! This is absolutely terrible and debestating! I wish the best to all those on board! Extended Version - https://m.youtube.com/watch?v=pz_v6w2x4cA 😷😷
The new #coronavirus is spread by droplets that come from the mouth or nose. The droplets don’t stay floating in the air. This is not an airborne virus. #2019nCoV
Dinner time in Chinatown and the restaurants are near empty! What’s going on? There are no confirmed cases of #coronavirus in NYC, but just the fear of it is sending customers into a panic. Merchants in lower Manhattan, Brooklyn and Flushing are suffering. @abc7ny
As the novel #coronavirus outbreak unfolds, medical staff are trying their best to treat and cheer up patients. The words of encouragement and love are more important than anything else. #China #StayStrong
A hundred people a day perishing in China from #coronavirus - and that is the number they are releasing. Who knows what’s really up there? 
Outing the Outbreak: @DrMarcSiegel says China has suppressed information regarding the Coronavirus. #CoronavirusOutbreak “Virus-hit Wuhan has two laboratories linked to Chinese bio-warfare program.” ~WashingtonTimes #Wuhan #China
Disinfection in #Wuhan #Coronavirus 
Staff from @CAPublicHealth and our many partners are working together in our Medical and Health Coordination Center. We're activated for novel #coronavirus. Public health is carefully assessing the situation and taking action on what we know about #nCoV2019.
Ok so #coronavirus isn't funny, but half this video is of a Starlux A321neo getting a ceremonial water cannon spray for an inaugural flight, mistaken for it being disinfected and that's hilarious. 
China has widely embraced online learning as #coronavirus outbreak postponed the start of spring semester. Some 600,000 teachers have joined the online curriculum covering 50 million students across China. 
